Title,Channel,Subscribers,Views,Likes,Duration (seconds),URL
Jhilmil Sitaron Ka Aangan Hoga - Mohammad Rafi & Lata Mangeshkar - Laxmikant Pyarelal Songs,Bollywood Classics,"20,600,000","148,301,947","414,237",321,https://www.youtube.com/watch?v=v13cUeX6_co
"Aadmi Musafir Hai Aata Hai Jata Hai (I) | Lata Mangeshkar, Mohammed Rafi | Apnapan 1977 Songs",Goldmines Gaane Sune Ansune,"45,600,000","121,986,718","332,383",273,https://www.youtube.com/watch?v=ipePh7hAkYc
"Jo Wada Kiya Woh Nibhana Padega Full Song With Lyrics | Mohammed Rafi, Lata Mangeshkar | Taj Mahal",Goldmines Gaane Sune Ansune,"45,600,000","111,909,261","349,981",199,https://www.youtube.com/watch?v=u-ioONenaAQ
Patthar Ke Sanam Tujhe Humne | Mohammed Rafi |  Patthar Ke Sanam 1967 Songs| Waheeda Rehman,Goldmines Gaane Sune Ansune,"45,600,000","109,226,446","363,934",313,https://www.youtube.com/watch?v=Ij20-IEUTjg
Do Raaste - Yeh Reshmi Zulfein Yeh Sharbati Aankhein - Mohd Rafi,Shemaroo,"57,600,000","105,581,565","358,213",241,https://www.youtube.com/watch?v=q9aMSJGAkeY
Mere Huzoor - Gum Uthane Ke Liye Main To Jiye Jaunga - Mohd.Rafi,Shemaroo,"57,600,000","91,595,330","223,863",286,https://www.youtube.com/watch?v=RJBqyi-o4qw
"Badan Pe Sitare Lapete Huye | Mohammad Rafi | Prince | Shammi Kapoor, Vyjayanthimala",Red Chillies Entertainment,"13,300,000","79,942,364","516,734",345,https://www.youtube.com/watch?v=MkABeVCv4lw
"Aaj Mausam Bada Beimaan Hai - Dharmendra, Mohammed Rafi, Loafer Song",Ultra Bollywood,"43,400,000","69,024,792","282,993",252,https://www.youtube.com/watch?v=aSJ_jcEPOu0
Hawas - Teri Galiyon Mein Na Rakheinge Kadam - Mohd Rafi,Shemaroo,"57,600,000","67,640,090","268,236",221,https://www.youtube.com/watch?v=0weRgdk8_do
Aane Se Uske Aaye Bahar - Jeene Ki Raah - Mohammed Rafi Hit Songs - Laxmikant Pyarelal Songs,Bollywood Classics,"20,600,000","64,586,064","278,745",190,https://www.youtube.com/watch?v=GNTNnp5rk5E
Mere Dushman Tu Meri Dosti Ko Tarse | Mohammed Rafi | Aaye Din Bahaar Ke (1966) Songs | Dharmendra,Goldmines Gaane Sune Ansune,"45,600,000","62,989,751","215,374",357,https://www.youtube.com/watch?v=ClOyNlOzBRQ
Gulabi Aankhen Jo Teri Dekhi (Original Version) Mohammed Rafi | The Train 1970 Songs | Rajesh Khanna,Goldmines Gaane Sune Ansune,"45,600,000","59,113,967","335,505",217,https://www.youtube.com/watch?v=I5t894l5b1w
"Main Ek Raja Hoon - Video Song | Jaya Bachchan, Swaroop Dutt | Mohammad Rafi |Laxmikant Pyarelal",Bollywood Classics,"20,600,000","51,239,548","126,599",275,https://www.youtube.com/watch?v=B9WSRw-ObEY
"Chhup Gaye Saare Nazaare | Rajesh Khanna, Mumtaz Songs | Mohd Rafi Hit Songs | Do Raaste Songs",Mohd Rafi Hit Songs,"789,000","51,033,365","152,856",275,https://www.youtube.com/watch?v=LtiqTU9BnrA
O Firkiwali Tu Kal Phir Aana | Mohammed Rafi | Raja Aur Runk 1968 Songs | Sanjeev Kumar,Goldmines Gaane Sune Ansune,"45,600,000","43,899,242","149,775",244,https://www.youtube.com/watch?v=vbIP6b0BArs
"Mere Mitwa Mere Meet Re (Solo) | Mohammed Rafi | Geet 1970 Songs | Rajendra Kumar, Mala Sinha",Goldmines Gaane Sune Ansune,"45,600,000","43,794,644","153,536",224,https://www.youtube.com/watch?v=F8rd81sjAnY
आया रे खिलौने वाला (Part 3) | Bachpan Movie Songs (1970) | Mohammed Rafi Songs | Sanjeev Kumar,Shemaroo Filmi Gaane,"71,200,000","43,216,684","190,843",283,https://www.youtube.com/watch?v=YFQTpJVW56o
Nafrat Ki Duniya Ko Chhod Ke - LYRICAL Video Song | Mohammed Rafi Song | Rajesh Khanna Song,Bollywood Retro,"842,000","41,497,091","142,973",258,https://www.youtube.com/watch?v=z5YriVMF2pU
"Dil Kahe Ruk Ja Re Ruk Ja |Mohammed Rafi | Man Ki Aankhen 1970 Songs | Dharmendra, Waheeda Rehman",Goldmines Gaane Sune Ansune,"45,600,000","41,288,400","103,480",353,https://www.youtube.com/watch?v=jhJBhXcWBxQ
"Yeh Chand Sa Roshan Chehra 4K Song - Kashmir Ki Kali | Mohammed Rafi |Sharmila Tagore, Shammi Kapoor",SuperHit Gaane,"7,540,000","40,013,208","264,107",316,https://www.youtube.com/watch?v=VueN49P7JyU
Falak Se Tod Kar Dekho Sitare | Mohammed Rafi | Aan Milo Sajna 1970 Songs | Asha Parekh,Goldmines Gaane Sune Ansune,"45,600,000","39,135,270","83,823",266,https://www.youtube.com/watch?v=doUjobe-uxU
Abhi Na Jaao Chhod Kar | Dev Anand | Sadhana | Mohd Rafi | Asha Bhosle | Hum Dono (1961),Shemaroo Filmi Gaane,"71,200,000","35,523,765","320,281",247,https://www.youtube.com/watch?v=mfEQgoVi7P4
"Likhe Jo Khat Tujhe | 4K Video | Kanyadaan | Shashi Kapoor, Asha Parekh | Mohammed Rafi",Mohammed Rafi,"856,000","34,461,667","261,560",288,https://www.youtube.com/watch?v=DRBxROqWOPk
"Garibon Ki Suno Wo Tumhari Sunega - Mohammed Rafi Song | Hindi Dard Bhare Gane | Sanjay Khan, Babita",Dard Bhare Songs,"4,380,000","33,587,311","98,084",491,https://www.youtube.com/watch?v=HNhCMIIMdS0
"Khilona Jaan Kar Tum Toh | Mohammed Rafi | Khilona 1970 Songs | Sanjeev Kumar, Mumtaz",Goldmines Gaane Sune Ansune,"45,600,000","32,908,508","132,564",268,https://www.youtube.com/watch?v=2SiEqSoAjeY
Raha Gardishon Mein Hardam Mere Ishq Ka Sitara | Mohammed Rafi | Do Badan Songs | Manoj Kumar,Goldmines Gaane Sune Ansune,"45,600,000","28,642,999","107,282",301,https://www.youtube.com/watch?v=-ky5WZ-ho9o
Mile Na Phool To - Parikshit Sahni - Zaheeda Hussain - Anokhi Raat - Bollywood Songs - Mohd Rafi,Shemaroo Filmi Gaane,"71,200,000","28,561,030","87,557",208,https://www.youtube.com/watch?v=7xIfJdD4AIU
Baharon Phool Barsao - Hindi Lyrics | बहारों फूल बरसाओ | Suraj | Rajendra Kapoor | Mohammed Rafi,Bollywood Classics,"20,600,000","25,215,249","74,565",266,https://www.youtube.com/watch?v=M8ichCVyxhQ
Janewalo Zara Mudke Dekho Video Song | Dosti | Mohammad Rafi's Hit Song | Laxmikant Pyarelal Songs,Bollywood Classics,"20,600,000","24,845,651","182,472",322,https://www.youtube.com/watch?v=MMSdd9aViVs
Bhari Duniya Mein Aakhir Dil Ko Samjhane Kahan Jayen | Mohammad Rafi | Do Badan Sogns | Manoj Kumar,Goldmines Gaane Sune Ansune,"45,600,000","22,585,884","75,242",323,https://www.youtube.com/watch?v=OYf-YnlPwMQ
Oh Duniya Ke Rakhwaale | Mohammad Rafi | K.J. Yesudas | Hindi Song,Wilson Jukebox,"542,000","20,361,374","111,012",774,https://www.youtube.com/watch?v=yrf_BBGO5PI
Mere Huzoor - Rukh Se Zara Naqab Utha Do Mere Huzoor - Mohd.Rafi,Shemaroo,"57,600,000","18,891,294","66,011",263,https://www.youtube.com/watch?v=MTwtrF243kY
"Chal Ud Jare Panchhi (sad) - Mohammed Rafi, Bhabhi Song",Ultra Bollywood,"43,400,000","18,809,509","66,442",251,https://www.youtube.com/watch?v=HyUP1NwVj4U
Yeh Duniya Yeh Mehfil Mere Kaam Ki Nahi 4K | Mohammed Rafi Ka Dard | Raaj Kumar | Heer Ranjha Songs,SuperHit Gaane,"7,540,000","17,506,950","103,610",420,https://www.youtube.com/watch?v=EHcy-rquIZ4
"Hum Kaale Hai To Kya Hua : Mohammed Rafi | Mehmood, Helen | Gumnaam",Gaane 70s 80s,"1,110,000","17,098,127","59,696",350,https://www.youtube.com/watch?v=ryzHT5foN6o
Mohd Rafi - Lata Mangeshkar : Tumhari Nazar Kyon Khafa Ho Gayi | Hindi Song | Mala Sinha | Biswajeet,Dard Bhare Songs,"4,380,000","16,887,010","56,430",539,https://www.youtube.com/watch?v=NzKawL22oOc
Mera Toh Jo Bhi Kadam Hai Video Song | Dosti | Mohammad Rafi Hits | Laxmikant Pyarelal Songs,Bollywood Classics,"20,600,000","15,653,491","76,641",242,https://www.youtube.com/watch?v=tP0D6ZJll1M
Toote Hue Khwabon (HD) | Madhumati Songs | Dilip Kumar | Vyjayantimala | Mohd Rafi,Shemaroo Filmi Gaane,"71,200,000","14,980,370","74,975",214,https://www.youtube.com/watch?v=xkjfF11k7ls
Mujhe Teri Mohabbat Ka | Rajendra Kumar Hit Songs | Mohd Rafi Hit Songs | Aap Aye Bahaar Ayee Songs,Desi Music Library,"442,000","14,683,237","46,691",379,https://www.youtube.com/watch?v=s1AzkxS3jE8
Main Zindagi Ka Saath Nibhaata Chala Gaya | Mohd. Rafi | Dev Anand | Hum Dono (1961),Shemaroo Filmi Gaane,"71,200,000","13,948,725","92,814",228,https://www.youtube.com/watch?v=ivBhqDtJeiw
Pukarta Chala Hoon Main (HD) | Mere Sanam (1965) | Asha Parekh | Biswajit Chatterjee | Mohd.Rafi,Shemaroo Filmi Gaane,"71,200,000","12,462,875","66,468",229,https://www.youtube.com/watch?v=gLKBwutnPwA
Maine Poochha Chand Se (Lyrical Video) | Mohammed Rafi | R. D. Burman | Revibe | Hindi Songs,Universal Music India,"2,260,000","11,935,234","66,188",309,https://www.youtube.com/watch?v=_3M_D6OTD1Q
ये जो चिलमन है | Ye Jo Chilman Hai Dushman hai hamaari Video Song | Mohammed Rafi | Anand Bakshi,SRE MUSIC,"609,000","11,882,740","43,980",268,https://www.youtube.com/watch?v=uVv8uQTjIOk
Chahunga Main Tujhe Saanjh Savere - Hindi Lyrics | Dosti | Mohammad Rafi Hits | Laxmikant Pyarelal,Bollywood Classics,"20,600,000","11,795,550","62,828",264,https://www.youtube.com/watch?v=qnqwYQSqOIM
"Yeh Maana Meri Jaan Mohabbat Saza Hai 4K | Mohammed Rafi | Navin Nischol, Priya R | Hanste Zakham",SuperHit Gaane,"7,540,000","11,200,819","38,459",462,https://www.youtube.com/watch?v=pWU1Ud7t0us
"Bekhudi Mein Sanam (HD)| Mohammed Rafi, lata mangeshkar | Shashi Kapoor, Babita | NH Hindi Songs",NH Hindi Songs,"5,840,000","10,512,793","27,272",347,https://www.youtube.com/watch?v=5QBc2cI3NH0
Udein Jab Jab Zulfen Teri | Naya Daur | Mohammed Rafi | Dilip Kumar | Vyjayantimala,Bollywood Sadabahar Song,"336,000","9,118,906","25,095",279,https://www.youtube.com/watch?v=xdh0VaKi2jQ
Abhi Na Jao Chhodkar | World Music Day Concert 24 | Sourendro-Soumyojit,Sourendro Soumyojit,"339,000","9,058,608","221,598",345,https://www.youtube.com/watch?v=AB-I3vsUk6g
Mohd. Rafi Hindi Song : Yeh Mana Meri Jaan Mohabbat Sazaa Hai | Navin Nischol | Priya Rajvansh,Dard Bhare Songs,"4,380,000","8,458,867","26,707",683,https://www.youtube.com/watch?v=KhdAFcWMuRY
Dil Ke Jharokhe Mein | Brahmachari (1968) | Shammi Kapoor | Rajshree | Romantic Sad Song,NH Hindi Songs,"5,840,000","7,318,237","38,519",588,https://www.youtube.com/watch?v=JHKFyeYyeG0
Rimjhim Ke Geet Saawan Gaaye | Lata Mangeshkar | Mohammed Rafi | Superhit Romantic Song,Retro Hit Songs,"432,000","7,086,653","23,459",271,https://www.youtube.com/watch?v=nFFQb348_kw
"हम काले हैं तोह क्या हुआ (4K Lyrical) Mohammed Rafi Songs : Mehmood, Helen | Gumnaam (1965) Songs",SuperHit Gaane,"7,540,000","6,953,626","30,658",361,https://www.youtube.com/watch?v=pgeyRvKTFdc
"ओ नन्हे फ़रिश्ते -4K | Superhit Hindi Song |Mohd Rafi |Sadhana, Sanjay Khan | Ek Phool Do Mali [1969]",SuperHit Gaane,"7,540,000","6,789,542","31,928",276,https://www.youtube.com/watch?v=XBHQKcjkYm4
"Chalke Teri Aankhon Se Sharab | Mohammed Rafi | Arzoo 1965 Songs | Sadhana, Rajendra Kumar",Goldmines Gaane Sune Ansune,"45,600,000","6,519,901","25,756",255,https://www.youtube.com/watch?v=Qs5d8NGO6no
Mohammed Rafi : Yeh Duniya Yeh Mehfil Mere Kaam Ki Nahi | Hindi Song | Old Bollywood Dard Bhara Geet,Dard Bhare Songs,"4,380,000","6,469,332","28,295",566,https://www.youtube.com/watch?v=BgGbI174sCc
Mohammad Rafi Sahab Ke Is Live Program Ke Liye Shri Lanka Government Ne National Holiday Declare Kia,ahsanqasimindia,"299,000","5,929,140","213,672",22,https://www.youtube.com/watch?v=9JpUSJEJB0E
Mohammed Rafi - Maine Puchha Chand Se (From ‘Abdullah’),UMusicIndiaVEVO,"213,000","5,694,224","47,484",306,https://www.youtube.com/watch?v=lq5T-4gn4YA
rafi sahab live performance,Golden era of legends,"129,000","5,536,796","257,265",29,https://www.youtube.com/watch?v=G2Su4BU_o6Q
नज़र ना लग जाये | Nazar Na Lag Jaye [4K] Song: Mohammed Rafi | Night In London | Mala Sinha/Biswajit,SuperHit Gaane,"7,540,000","5,481,632","23,328",247,https://www.youtube.com/watch?v=Y2QLjRWXdAA
Best of Mohammad Rafi's Superhit Songs.. #ytshort #oldisgold #evergreenhindisongs,Cinema Ki Duniya ,"184,000","5,408,506","170,015",42,https://www.youtube.com/watch?v=kIvOZyflsDY
Tum Ne Mujhe Dekha - Rafi sahab Live Video,Javed Rafi,"101,000","5,231,564","37,618",120,https://www.youtube.com/watch?v=SN959Zm6at4
Main Kahin Kavi Na Ban Jaoon | Pyar Hi Pyar (1969) | Mohd. Rafi | Dharmendra | Vyjayanthimala,Mohd Rafi Hit Songs,"789,000","5,186,964","19,806",257,https://www.youtube.com/watch?v=yRbHRd-rn30
"Dil Ne Phir Yaad Kiya Song HD - Mohammed Rafi, Suman Kalyanpur | Dharmendra, Nutan | @SuperHitGaane",SuperHit Gaane,"7,540,000","5,072,946","19,772",312,https://www.youtube.com/watch?v=UxO_kVwpZ38
"Sare Shaher Mein Aapsa Koi Nahi Full Song 4K | Mohammed Rafi | Dilip Kumar, Leena Chandavarkar",SuperHit Gaane,"7,540,000","4,939,860","15,901",533,https://www.youtube.com/watch?v=22pXdOqTFEc
Yu Hee Tum Mujhase Baat Karatee Ho | Mohd Rafi Hit Songs | Lata Mangeshkar | Rajesh Khanna | Mumtaz,Mohd Rafi Hit Songs,"789,000","4,910,576","15,063",243,https://www.youtube.com/watch?v=EiD9h_SWtaU
O Nanhe Se Farishte Full Song | Mohammed Rafi | Hindi Song | Sanjay Khan | Ek Phool Do Mali,Dard Bhare Songs,"4,380,000","4,893,490","17,935",471,https://www.youtube.com/watch?v=npeJjObc7dE
"Mujhe Duniyawalo Sharabi Na Samjho - Mohd Rafi Songs - Dilip Kumar, Vyjayanthimala | Leader 1964",SuperHit Gaane,"7,540,000","4,591,727","20,998",270,https://www.youtube.com/watch?v=ac6TsffSaTk
Abhi Na Jao Chhod Kar | Audio Song | अभी ना जाओ छोड़कर | Mohammed Rafi | Asha Bhosle | Hum Dono,Saregama Music,"53,400,000","4,417,272","47,541",271,https://www.youtube.com/watch?v=oDfK3RfSlKk
"Yeh Duniya, Yeh Mehfil - यह दुनिया यह महफ़िल Mohammed Rafi का दर्द भरा गीत - Raaj Kumar| Heer Ranjha",Rafi Ke Gaane,"229,000","4,264,836","17,634",420,https://www.youtube.com/watch?v=ZI7u8jPrwgs
Wadiyan Mera Daman with lyrics | वादियाँ मेरा दामन | Mohammed Rafi | Abhilasha,Saregama Music,"53,400,000","4,153,201","21,965",235,https://www.youtube.com/watch?v=nvtjhafNPU4
Mohammed Rafi and Kishore Kumar Hits | Yeh Sham Mastani | Likhe Jo Khat Tujhe | Old Hindi Songs 2025-03-14 09:10,Wings Music,"1,610,000","3,984,841","10,381",0,https://www.youtube.com/watch?v=-sjRbCEZlFQ
Baharon Phool Barsao Full Song (HD) | Suraj Songs 1966 | Mohammed Rafi Songs | Shankar Jaikishan Hit,Bollywood Classics,"20,600,000","3,870,120","18,731",266,https://www.youtube.com/watch?v=P6p45E3lxb4
"Falsafa Pyar Ka Tum Kya Jano | Mohammed Rafi | Duniya 1968 Songs | Dev Anand, Vyjayanthimala",Goldmines Gaane Sune Ansune,"45,600,000","3,535,783","14,022",302,https://www.youtube.com/watch?v=g8t76WtSNIY
"Mohammed Rafi : Aapke Pahlu Mein Aakar Ro Diye | Sunil Dutt, Sadhana | Bollywood Old Dard Bhare Song",Dard Bhare Songs,"4,380,000","3,493,249","13,582",344,https://www.youtube.com/watch?v=1jXRhHnj-aU
इसलिए तो हर कोई used to love Mohd. Rafi sahab! #Shorts #SuperstarSinger #NehaKakkar #YTShorts,SET India,"182,000,000","3,232,181","166,948",40,https://www.youtube.com/watch?v=ZWdJh9PQP1s
Tumne Mujhe Dekha Hokar Meherban with lyrics | Teesri Manzil | Mohammed Rafi,Saregama Music,"53,400,000","3,200,271","27,381",248,https://www.youtube.com/watch?v=_Xvb3MiOfNg
Jo Baat Tujhmein Hai Full Song With Lyrics | Mohammed Rafi | Taj Mahal 1963 Songs | Pradeep Kumar,Goldmines Gaane Sune Ansune,"45,600,000","2,904,347","14,066",213,https://www.youtube.com/watch?v=K-LpErDQEps
Pukarta Chala Hoon Main with lyrics | पुकारता चला हूँ मैं | Mohammed Rafi | Mere Sanam,Saregama Music,"53,400,000","2,578,335","24,246",252,https://www.youtube.com/watch?v=pp4udOzbLRU
Ehsan Tera Hoga Mujh Par with Lyrics | एहसान तेरा होगा मुझ पर के बोल | Mohammed Rafi,Saregama Music,"53,400,000","2,545,609","37,361",232,https://www.youtube.com/watch?v=FQOGWitvUbw
Tumhari Nazar Kyon Khafa Ho Gayi 💖(4K Song) - Mohd Rafi - Lata Mangeshkar | Biswajeet and Mala Sinha,Duet Hindi Songs,"225,000","2,390,726","7,888",315,https://www.youtube.com/watch?v=uYrBlVh8BVA
Best of Mohammad Rafi's Sad Songs..#ytshorts_ #hearttouching #emotional #sad #rafi,Cinema Ki Duniya ,"184,000","2,325,167","114,846",55,https://www.youtube.com/watch?v=jwnUQ9hWpvQ
Kaun Hai Jo Sapnon Mein Aaya | Rajendra Kumar | Saira Banu | Jhuk Gaya Aasman | Mohammad Rafi Songs,Shemaroo 4K Hindi Songs,"532,000","2,038,920","12,669",221,https://www.youtube.com/watch?v=sFOV7rILTcU
Mohammad Rafi Hit Songs | मोहम्मद रफी के सदाबहार गीत Old is Gold | Lata mangeshkar & Mahendra Kapoor,70s evergreen,"153,000","1,996,979","49,807",15,https://www.youtube.com/watch?v=T29whFK2s0I
O Mere Shaah-E-Khoobaan Song | ओ मेरे शाह-ए-खूबाँ | Mohammed Rafi | love in tokyo movie song,SRE MUSIC,"609,000","1,387,375","5,452",289,https://www.youtube.com/watch?v=ngC6W_ctdS0
Tu Is Tarah Se Meri Zindagi Me | Deepak Parashar | Ranjeeta | Raj Babbar | Mohammad Rafi Hit Songs,Sadabahar Gaane,"304,000","1,169,378","6,597",284,https://www.youtube.com/watch?v=9htOthhdZpQ
Mohammed Rafi | Aaj Purani Raahon Se 4K | आज पुरानी राहों से | Dilip Kumar | Aadmi 1968 | Waheeda R,SuperHit Gaane,"7,540,000","1,167,825","6,450",220,https://www.youtube.com/watch?v=t8iLpCoXWtA
O Phirkiwali | Mohammad Rafi Superhit Song,Bollywood Classics,"20,600,000","1,042,211","28,154",32,https://www.youtube.com/watch?v=K-S87J6vdGI
Best to RAFI SAAB Hi Hain_Kishore Da??#trending#shorts#reels#facts #star#motivation#latestviral,Diwan-e-Nazar,"1,240,000","995,015","84,606",60,https://www.youtube.com/watch?v=9PQpbMRBdzo
"Chehre Pe Giri Julfe | Rajendra Kumar, Vyjayanthimala | Mohammed Rafi Songs",Bollywood Classics,"20,600,000","969,399","21,360",58,https://www.youtube.com/watch?v=p6YmZdr32mg
Mohammed Rafi Sahab Singing His First Song 🎵Live.,ahsanqasimindia,"299,000","891,260","40,789",15,https://www.youtube.com/watch?v=X5Uazxqhah0
Tujhe Pyar Karte Hain Karte Rahenge Video Song | Mohammed Rafi Suman Kalyanpur |Biswajeet Saira Banu,SuperHit Gaane,"7,540,000","582,337","3,118",357,https://www.youtube.com/watch?v=rpMc1Eaw57M
Chal Ud Jare Panchhi 4K Video in Color | Mohammed Rafi Old Song | Bhabhi 1957 Songs,SuperHit Gaane,"7,540,000","534,292","3,555",258,https://www.youtube.com/watch?v=_ph6Krmzyl4
"Mohammed Rafi Songs: कहाँ जा रहा है तू HD | Nutan, Balraj Sahni | Shankar Jaikishan | Seema Songs",SuperHit Gaane,"7,540,000","412,703","3,797",267,https://www.youtube.com/watch?v=Nlf1Lacjkrw
"60s Bollywood Hits 💘60s Hit Hindi Songs 💘 Mukesh, Lata Mangeshkar, Mohammed Rafi, Asha Bhosle",Retro Rythem,"240,000","349,165","6,192",32,https://www.youtube.com/watch?v=2YUUHfKm_rE
Hum Bekhudi Mein Tum Ko Pukare HD Song - Mohd Rafi Songs - Dev Anand Sad Songs | Kala Pani,SuperHit Gaane,"7,540,000","293,320","3,686",205,https://www.youtube.com/watch?v=Bz4SvsSCoxE
"Mere Yaar Shabba Khair 4K Song | Mohammed Rafi, Lata Mangeshkar | Shammi Kapoor, Saira Banu",SuperHit Gaane,"7,540,000","193,261","1,204",317,https://www.youtube.com/watch?v=zDGPjHWqb5k
superhit song Mohammad Rafi || best Bollywood song || hindi gane || purane gane || hindi old song,70s evergreen,"153,000","173,290","3,772",15,https://www.youtube.com/watch?v=uG9d5GRinpA
Mohammed Rafi | Sad Song | Na Aadmi Ka Koi Bharosa 4K | Manoj Kumar | Waheeda Rehman | Aadmi 1968,SuperHit Gaane,"7,540,000","169,554","1,062",218,https://www.youtube.com/watch?v=vTQRWEdD660
Top 5 Songs By Mohammed Rafi Sahab 😍 | Saxenaji,Saxenaji,"132,000","149,853","9,230",56,https://www.youtube.com/watch?v=Po4Oa4IRD20
"Main Galiyon Ka Raja| Dharam Veer (1977) |Dharmendra,Zeenat Aman |Mohd. Rafi Songs #oldsong",Yt chandan sah 0.2,"151,000","138,305","2,720",15,https://www.youtube.com/watch?v=pqzxbJTaljY
"Lata Mangeshkar Ji , Mohammed Rafi Sahab #latamageshkar #mohammedrafi #sonunigam #viralvideo",Nightingale,"843,000","137,946","5,663",29,https://www.youtube.com/watch?v=gZ6_DtkyFEA
